{
  "schema_version": "cacp.pilot_readiness_checklist.v0.1",
  "checklist_id": "pilot-readiness-temporary-playground-repair-notice",
  "contract_id": "ctc-temporary-playground-repair-notice",
  "readiness_level": "public_demo_only",
  "reviewed_by": "actor-community-operator-console",
  "reviewed_at": "2026-06-25T02:05:00Z",
  "summary": "Synthetic checklist for a temporary playground repair notice. The public demo can show resident-facing property operation notice before scheduling, but a real pilot still requires operator accountability, consent rules, safety review, and production audit logging.",
  "gates": {
    "consent": {
      "status": "needs_real_world_review",
      "real_pilot_requirement": "Publish real community rules for amenity repair notices and any consent or opt-out process before using real resident communication channels.",
      "evidence_ids": [],
      "artifact_ids": [],
      "notes": "The demo uses a synthetic public notice and no resident contact list."
    },
    "operator_approval": {
      "status": "needs_real_world_review",
      "real_pilot_requirement": "A named property operator must approve the repair scope, boundary, time window, contractor access, and resident communication plan.",
      "evidence_ids": [],
      "artifact_ids": [],
      "notes": "The synthetic transition demonstrates notice timing, not production approval authority."
    },
    "resident_notice": {
      "status": "simulated_for_demo",
      "real_pilot_requirement": "Residents must receive plain-language notice before the playground is closed, repaired, or rerouted.",
      "evidence_ids": ["evidence-playground-repair-resident-notice"],
      "artifact_ids": ["artifact-playground-repair-resident-notice"],
      "notes": "Synthetic notice evidence shows the repair window was posted before scheduling."
    },
    "privacy_boundary": {
      "status": "simulated_for_demo",
      "real_pilot_requirement": "The notice must avoid exposing resident identities, exact units, worker personal details, camera feeds, or complaint histories.",
      "evidence_ids": ["evidence-playground-repair-resident-notice"],
      "artifact_ids": ["artifact-playground-repair-resident-notice"],
      "notes": "Synthetic evidence records real_identity_stored=false."
    },
    "data_minimization": {
      "status": "simulated_for_demo",
      "real_pilot_requirement": "Collect only repair window, affected amenity, safety boundary, alternate route, and operator contact facts needed for resident notice.",
      "evidence_ids": ["evidence-playground-repair-resident-notice"],
      "artifact_ids": ["artifact-playground-repair-resident-notice"],
      "notes": "The public example stores no resident profile, access token, sensor, camera, or payment data."
    },
    "audit_log": {
      "status": "needs_real_world_review",
      "real_pilot_requirement": "Log notice creation, approval, publication, repair window changes, cancellations, resident concerns, and incident follow-up.",
      "evidence_ids": [],
      "artifact_ids": ["artifact-playground-repair-resident-notice"],
      "notes": "The synthetic notice artifact is not a production audit system."
    },
    "human_handoff": {
      "status": "simulated_for_demo",
      "real_pilot_requirement": "Name a human operator who can answer resident questions, update the notice, pause work, or reroute foot traffic.",
      "evidence_ids": ["evidence-playground-repair-resident-notice"],
      "artifact_ids": ["artifact-playground-repair-resident-notice"],
      "notes": "The contract fallback owner is operator."
    },
    "manual_stop": {
      "status": "needs_real_world_review",
      "real_pilot_requirement": "Provide a stop or pause process for unsafe conditions, resident concern, contractor delay, or boundary change.",
      "evidence_ids": [],
      "artifact_ids": [],
      "notes": "The public example has no real work order or access-control integration."
    },
    "incident_review": {
      "status": "needs_real_world_review",
      "real_pilot_requirement": "Define review for injury risk, unnoticed closure, blocked route, resident complaint, or contractor safety issue.",
      "evidence_ids": [],
      "artifact_ids": [],
      "notes": "The lifecycle allows incident_review, but no real incident process is connected."
    },
    "data_retention": {
      "status": "needs_real_world_review",
      "real_pilot_requirement": "Publish retention windows for repair notices, approvals, resident concerns, schedule changes, and incident records.",
      "evidence_ids": [],
      "artifact_ids": ["artifact-playground-repair-resident-notice"],
      "notes": "The synthetic notice artifact uses task_lifetime only as a demo placeholder."
    },
    "fallback_owner": {
      "status": "simulated_for_demo",
      "real_pilot_requirement": "Assign a named operator responsible for updating the notice, keeping alternate access clear, and pausing work if conditions change.",
      "evidence_ids": ["evidence-playground-repair-resident-notice"],
      "artifact_ids": ["artifact-playground-repair-resident-notice"],
      "notes": "The synthetic contract assigns operator as fallback owner."
    },
    "physical_safety_review": {
      "status": "needs_real_world_review",
      "real_pilot_requirement": "Review playground repair boundary, detour route, child safety, contractor access, weather, noise, and reopening criteria.",
      "evidence_ids": [],
      "artifact_ids": [],
      "notes": "The public demo does not validate real site conditions or contractor safety controls."
    }
  },
  "public_demo_boundary": {
    "fictional_or_synthetic_only": true,
    "no_real_residents": true,
    "no_real_property_access": true,
    "no_real_locks_cameras_sensors_or_robots": true,
    "no_payments_or_access_tokens": true,
    "requires_user_approval_before_real_pilot": true
  },
  "data_policy": "fictional_or_synthetic_only"
}
