{
  "schema_version": "cacp.pilot_readiness_checklist.v0.1",
  "checklist_id": "pilot-readiness-elder-friendly-walking-helper",
  "contract_id": "ctc-elder-friendly-walking-helper",
  "readiness_level": "public_demo_only",
  "reviewed_by": "actor-community-operator-console",
  "reviewed_at": "2026-06-24T08:05:00Z",
  "summary": "Synthetic checklist for the elder-friendly walking helper contract. The public demo can show notice and helper governance shape, but a real pilot still requires consent, helper accountability, privacy review, and incident process.",
  "gates": {
    "consent": {
      "status": "needs_real_world_review",
      "real_pilot_requirement": "Collect explicit participant consent and helper participation terms before assigning real elder-friendly support.",
      "evidence_ids": [],
      "artifact_ids": [],
      "notes": "The demo contains no real resident or helper identity."
    },
    "operator_approval": {
      "status": "needs_real_world_review",
      "real_pilot_requirement": "A named operator must approve helper availability, accessible route boundaries, and escalation rules.",
      "evidence_ids": [],
      "artifact_ids": [],
      "notes": "The synthetic transition only moves from resident notice to operator review, not final approval."
    },
    "resident_notice": {
      "status": "simulated_for_demo",
      "real_pilot_requirement": "Residents must receive clear notice covering route, helper option, data boundaries, opt-out path, and human contact.",
      "evidence_ids": ["evidence-elder-walk-resident-notice"],
      "artifact_ids": ["artifact-elder-walk-resident-notice"],
      "notes": "Synthetic notice evidence exists only to demonstrate protocol shape."
    },
    "privacy_boundary": {
      "status": "simulated_for_demo",
      "real_pilot_requirement": "Avoid exposing health, family, exact unit, or identity details when arranging helper support.",
      "evidence_ids": ["evidence-elder-walk-resident-notice"],
      "artifact_ids": ["artifact-elder-walk-resident-notice"],
      "notes": "Synthetic evidence records real_identity_stored=false."
    },
    "data_minimization": {
      "status": "simulated_for_demo",
      "real_pilot_requirement": "Collect only route preference, helper opt-in state, time window, and safety escalation facts needed for support.",
      "evidence_ids": ["evidence-elder-walk-resident-notice"],
      "artifact_ids": ["artifact-elder-walk-resident-notice"],
      "notes": "The public example stores no health, family, or identity data."
    },
    "audit_log": {
      "status": "needs_real_world_review",
      "real_pilot_requirement": "Log notice, helper assignment, route changes, cancellations, handoff, incidents, and deletion requests.",
      "evidence_ids": [],
      "artifact_ids": [],
      "notes": "Current examples validate notice evidence but do not implement production audit storage."
    },
    "human_handoff": {
      "status": "simulated_for_demo",
      "real_pilot_requirement": "Assign a human helper or operator who can shorten, pause, or cancel the route when conditions change.",
      "evidence_ids": ["evidence-elder-walk-resident-notice"],
      "artifact_ids": ["artifact-elder-walk-resident-notice"],
      "notes": "The contract fallback owner is human_helper."
    },
    "manual_stop": {
      "status": "needs_real_world_review",
      "real_pilot_requirement": "Provide a simple human stop/cancel path for the resident, helper, or operator.",
      "evidence_ids": [],
      "artifact_ids": [],
      "notes": "This is a human workflow rather than device control, but a real pilot still needs a stop path."
    },
    "incident_review": {
      "status": "needs_real_world_review",
      "real_pilot_requirement": "Define review for discomfort, route crowding, weather change, missed helper contact, or accessibility issue.",
      "evidence_ids": [],
      "artifact_ids": [],
      "notes": "The protocol supports incident_review, but this example has no real incident process."
    },
    "data_retention": {
      "status": "needs_real_world_review",
      "real_pilot_requirement": "Publish retention windows for notice, helper assignment, route changes, incidents, and deletion events.",
      "evidence_ids": [],
      "artifact_ids": ["artifact-elder-walk-resident-notice"],
      "notes": "The synthetic notice artifact uses task_lifetime only as a demo placeholder."
    },
    "fallback_owner": {
      "status": "simulated_for_demo",
      "real_pilot_requirement": "Name the human helper or operator responsible for route shortening, assistance, or cancellation.",
      "evidence_ids": ["evidence-elder-walk-resident-notice"],
      "artifact_ids": ["artifact-elder-walk-resident-notice"],
      "notes": "The synthetic contract assigns human_helper as fallback owner."
    },
    "physical_safety_review": {
      "status": "needs_real_world_review",
      "real_pilot_requirement": "Review route accessibility, weather, crowding, rest points, helper response, and cancellation criteria.",
      "evidence_ids": [],
      "artifact_ids": [],
      "notes": "The public demo does not validate real route accessibility or resident mobility needs."
    }
  },
  "public_demo_boundary": {
    "fictional_or_synthetic_only": true,
    "no_real_residents": true,
    "no_real_property_access": true,
    "no_real_locks_cameras_sensors_or_robots": true,
    "no_payments_or_access_tokens": true,
    "requires_user_approval_before_real_pilot": true
  },
  "data_policy": "fictional_or_synthetic_only"
}
